{
  "schema_version": 1,
  "project_id": "selftest",
  "display_name": "Doctor self-test fixture",
  "created": "2026-01-01T00:00:00Z",
  "stack": { "framework": "nextjs-14-app-router", "language": "typescript", "db": "supabase-postgres", "auth": "supabase-auth", "payments": "stripe", "email": "resend", "ai": "anthropic", "package_manager": "npm" },
  "tenancy": { "model": "shared-schema-rls", "tenant_column": "org_id" },
  "deploy": { "target": "vercel", "prod_branch": "main", "site_url": "https://selftest.example.com" },
  "environments": { "prod": { "supabase_ref": "selftestprod", "protected": true } },
  "env_sources": { "runtime": "vercel-project-env", "required_keys": ["STRIPE_SECRET_KEY"], "never_read_by_agents": true },
  "risk_tier": "standard",
  "compliance": { "jurisdictions": ["TR"], "required_pages": ["kvkk"], "locales": ["tr"], "entity": { "legal_name": "Ornek Yazilim Anonim Sirketi", "address": "Ornek Mahallesi Ornek Caddesi No 1 Kadikoy Istanbul", "email": "destek@example.com", "mersis": "0000000000000000", "kep": "ornek@hs01.kep.tr" } },
  "agents": { "enabled": ["mavci-builder"] },
  "standards": { "packs": ["nextjs-app-router"] }
}
